<?xml version="1.0" encoding="UTF-8" standalone="no"?>
<!DOCTYPE setup SYSTEM "installsettings.dtd">
<!-- For a more detailed documentation see the autoinstall-example.ini
The configurable settings are mostly the same -->
<setup>
    <db>
        <host>
            HOST_NAME
        </host>
        <user>
            USER
        </user>
        <password>
            PASSWORD
        </password>
        <database>
            DATABASE_NAME
        </database>
        <charset>
            DATABASE_CHARSET
        </charset>
        <engine>DATABASE_COLLATION</engine>
        <collation>DATABASE_COLLATION</collation>
        <prefix>
            DATABASE_PREFIX
        </prefix>
        <option_mysqli_init_command>
            DATABASE_OPTION_MYSQLI_INIT_COMMAND
        </option_mysqli_init_command>
    </db>

    <path>
        <http_root_path>
            CONTENIDO_WEB_ROOT
        </http_root_path>
    </path>

    <client>
        <client_mode>
            CLIENTEXAMPLES
        </client_mode>
    </client>

    <admin_user>
        <password>
            SYSADMIN_PASSWORD
        </password>
        <email>
            SYSADMIN_EMAIL
        </email>
    </admin_user>
</setup>